{"argv":["git","checkout","811dc56d11018908610eb6772425d7c865ae931d"],"elapsed_seconds":0.0,"exit_code":128,"finished_at":"2026-10-18T04:42:30.003427+00:00","job_digest":"6d6e442692940124f1249f73d3f689dc65e2e6d2be6bb2d119a0728d579bebf2","job_id":"accept-agda-ns-b4-006","logs":[{"index":0,"path":".itir/colab/logs/accept-agda-ns-b4-006/0000.txt","sha256":"947847f81b5c491990644058a2a3c7201a39e884ef7b4042d447f7b530984b14","size_bytes":160}],"repository":"chboishabba/dashi_agda","resolved_commit_sha":"811dc56d11018908610eb6772425d7c865ae931d","runtime":{"after":{},"before":{}},"schema_version":"colab_prover_result_v1","started_at":"2026-10-18T04:42:30.003427+00:00","status":"FAILED","toolchain":{}}