{"argv":["bash","scripts/run_agda29_parallel_check.sh","DASHI/Physics/Closure/NSTriadKNCanonicalBAnalyticCutsetASTExact.agda"],"elapsed_seconds":18.526974376999988,"exit_code":42,"finished_at":"2026-10-18T06:29:19.926167+00:00","job_digest":"696552e68b8b2e6ff941e969c14149876d57503b186eee2114fe336838cc5ad4","job_id":"accept-agda-ns-b4-011","logs":[{"index":0,"path":".itir/colab/logs/accept-agda-ns-b4-011/0000.txt","sha256":"59dfb7b54d34b59a814b1419bb2b6cf1be78ad486806873ae5ee69de8b2f5dda","size_bytes":10199}],"repository":"chboishabba/dashi_agda","resolved_commit_sha":"748b6c9c5ef075c9dcdc8d550942978ea25f10f2","runtime":{"after":{"cpu_count":8,"memory_available_kib":51772480,"memory_total_kib":53467184,"os_kernel":"Linux 6.6.122+","python_version":"3.13.16","versions":{"agda":"Agda version 2.9.0"}},"before":{"cpu_count":8,"memory_available_kib":51753836,"memory_total_kib":53467184,"os_kernel":"Linux 6.6.122+","python_version":"3.13.16","versions":{"agda":"Agda version 2.9.0"}}},"schema_version":"colab_prover_result_v1","started_at":"2026-10-18T06:29:01.399193+00:00","status":"FAILED","toolchain":{"agda":"Agda version 2.9.0"}}