{"argv":["bash","scripts/run_agda29_parallel_check.sh","DASHI/Physics/Closure/NSCanonicalB4PhysicalR440AnalyticInterfaceExact.agda"],"elapsed_seconds":3.0100277390010888,"exit_code":42,"finished_at":"2026-10-18T04:13:19.045310+00:00","job_digest":"d65ab0fbd2e231eec6ed10137f65315222db46886d640bda3a7f134bf9c5b33f","job_id":"accept-agda-ns-b4-003","logs":[{"index":0,"path":".itir/colab/logs/accept-agda-ns-b4-003/0000.txt","sha256":"bc9cabfbc9b0df85e9833a94e21f7e8ebaf715869793ea2d61d2bad31fc8d075","size_bytes":784}],"repository":"chboishabba/dashi_agda","resolved_commit_sha":"e3cb609cda9ed7d55281afe32e7294589581b675","runtime":{"after":{"cpu_count":2,"memory_available_kib":12166104,"memory_total_kib":13286936,"os_kernel":"Linux 6.6.122+","python_version":"3.13.16","versions":{"agda":"Agda version 2.9.0"}},"before":{"cpu_count":2,"memory_available_kib":9265708,"memory_total_kib":13286936,"os_kernel":"Linux 6.6.122+","python_version":"3.13.16","versions":{"agda":"Agda version 2.9.0"}}},"schema_version":"colab_prover_result_v1","started_at":"2026-10-18T04:13:16.035282+00:00","status":"FAILED","toolchain":{"agda":"Agda version 2.9.0"}}