{"argv":["agda","--no-libraries","--no-default-libraries","-i",".","-i","DCHoTT-Agda","-i","vendor/bishop","-i","cubical","-i","/usr/share/agda-stdlib","-WnoUnsupportedIndexedMatch","DASHI/Physics/Closure/NSCanonicalB4PhysicalR440AnalyticInterfaceExact.agda"],"elapsed_seconds":1.0916377880002983,"exit_code":0,"finished_at":"2026-10-18T02:53:55.532572+00:00","job_digest":"000f420ff6cba098c3c4f93d8c3c839b1f0f2c23c14cc08917310e72f259b8ce","job_id":"accept-agda-ns-b4-002","logs":[{"index":0,"path":".itir/colab/logs/accept-agda-ns-b4-002/0000.txt","sha256":"a09846c705b35faa929cebbe42398b2a5f71c5214c1997bd50deb31a13c63cb2","size_bytes":508}],"repository":"chboishabba/dashi_agda","resolved_commit_sha":"e3cb609cda9ed7d55281afe32e7294589581b675","runtime":{"after":{"cpu_count":2,"memory_available_kib":12194688,"memory_total_kib":13286936,"os_kernel":"Linux 6.6.122+","python_version":"3.13.16","versions":{"agda":"Agda version 2.6.3"}},"before":{"cpu_count":2,"memory_available_kib":12181580,"memory_total_kib":13286936,"os_kernel":"Linux 6.6.122+","python_version":"3.13.16","versions":{"agda":"Agda version 2.6.3"}}},"schema_version":"colab_prover_result_v1","started_at":"2026-10-18T02:53:54.440934+00:00","status":"SUCCEEDED","toolchain":{"agda":"Agda version 2.6.3"}}