{"argv":["lake","build","QuantumMereology"],"elapsed_seconds":1789.7414131450005,"exit_code":-15,"finished_at":"2026-10-18T03:28:44.077972+00:00","job_digest":"81a291599c74a42c4e65234eeac6cbe4b84b36fc977acd960e16343439f7961e","job_id":"accept-lean-quantum-mereology-002","logs":[{"index":0,"path":".itir/colab/logs/accept-lean-quantum-mereology-002/0000.txt","sha256":"95099b3a3edd096816cd6bc8c3f81c84aadd2ea29aacdb68a9ad7d735f812c70","size_bytes":40060}],"repository":"chboishabba/dashi_lean4","resolved_commit_sha":"57795094baf0f74d4f9a67bbff946ec6998eda77","runtime":{"after":{"cpu_count":2,"memory_available_kib":11799780,"memory_total_kib":13286936,"os_kernel":"Linux 6.6.122+","python_version":"3.13.16","versions":{"lake":"Lake version 5.0.0-src+7e01a1b (Lean version 4.28.0)","lean":"Lean (version 4.28.0, x86_64-unknown-linux-gnu, commit 7e01a1bf5c70fc6167d49c345d3bf80596e9a79b, Release)"}},"before":{"cpu_count":2,"memory_available_kib":12159304,"memory_total_kib":13286936,"os_kernel":"Linux 6.6.122+","python_version":"3.13.16","versions":{"lake":"Lake version 5.0.0-src+7e01a1b (Lean version 4.28.0)","lean":"Lean (version 4.28.0, x86_64-unknown-linux-gnu, commit 7e01a1bf5c70fc6167d49c345d3bf80596e9a79b, Release)"}}},"schema_version":"colab_prover_result_v1","started_at":"2026-10-18T02:58:54.336559+00:00","status":"FAILED","toolchain":{"lake":"Lake version 5.0.0-src+7e01a1b (Lean version 4.28.0)","lean":"Lean (version 4.28.0, x86_64-unknown-linux-gnu, commit 7e01a1bf5c70fc6167d49c345d3bf80596e9a79b, Release)"}}