{"argv":["agda","DASHI/Physics/Closure/NSCanonicalB4PhysicalR440AnalyticInterfaceExact.agda"],"elapsed_seconds":0.17415513300011298,"exit_code":42,"finished_at":"2026-10-17T23:46:33.713705+00:00","job_digest":"413bfe410e36a63d8abb23aa564b3cae82cd2e5c9a82abc6bb2cf606af76f3e5","job_id":"accept-agda-ns-b4-001","logs":[{"index":0,"path":".itir/colab/logs/accept-agda-ns-b4-001/0000.txt","sha256":"34f2b95436fac1e0316fe4cfa7c2cda478956fefa1147ca0b4a214be024896e2","size_bytes":571}],"repository":"chboishabba/dashi_agda","resolved_commit_sha":"c54f826aeaadad2eedc4c9f7c438f1fa7c267658","runtime":{"after":{"cpu_count":2,"memory_available_kib":12085816,"memory_total_kib":13286936,"os_kernel":"Linux 6.6.122+","python_version":"3.13.16","versions":{"agda":"Agda version 2.6.3"}},"before":{"cpu_count":2,"memory_available_kib":12102148,"memory_total_kib":13286936,"os_kernel":"Linux 6.6.122+","python_version":"3.13.16","versions":{"agda":"Agda version 2.6.3"}}},"schema_version":"colab_prover_result_v1","started_at":"2026-10-17T23:46:33.539550+00:00","status":"FAILED","toolchain":{"agda":"Agda version 2.6.3"}}