{"argv":["lake","build","QuantumMereology"],"elapsed_seconds":268.4035728439999,"exit_code":1,"finished_at":"2026-10-17T23:54:08.665793+00:00","job_digest":"91ac15c5b291c5d83ad264bc3c7c384adc089eb9350469c6ab8455028e545f68","job_id":"accept-lean-quantum-mereology-001","logs":[{"index":0,"path":".itir/colab/logs/accept-lean-quantum-mereology-001/0000.txt","sha256":"e093ab4dbaee2c6bda2ce1072ee6f82edbf30d08361b190b3013d478311ddac4","size_bytes":77438}],"repository":"chboishabba/dashi_lean4","resolved_commit_sha":"57795094baf0f74d4f9a67bbff946ec6998eda77","runtime":{"after":{"cpu_count":2,"memory_available_kib":12039956,"memory_total_kib":13286936,"os_kernel":"Linux 6.6.122+","python_version":"3.13.16","versions":{"lake":"Lake version 5.0.0-src+470d5ce (Lean version 4.35.0-rc3)","lean":"Lean (version 4.35.0-rc3, x86_64-unknown-linux-gnu, commit 470d5ce1400764999581fd26d5d72b00d990b0f4, Release)"}},"before":{"cpu_count":2,"memory_available_kib":12062116,"memory_total_kib":13286936,"os_kernel":"Linux 6.6.122+","python_version":"3.13.16","versions":{"lake":null,"lean":null}}},"schema_version":"colab_prover_result_v1","started_at":"2026-10-17T23:49:40.262220+00:00","status":"FAILED","toolchain":{"lake":"Lake version 5.0.0-src+470d5ce (Lean version 4.35.0-rc3)","lean":"Lean (version 4.35.0-rc3, x86_64-unknown-linux-gnu, commit 470d5ce1400764999581fd26d5d72b00d990b0f4, Release)"}}